<?xml version="1.0" encoding="UTF-8"?>
<XMLProxySettings xmlns:xsi="http://www.w3.org/2001/XMLSchema-instance"
	xsi:noNamespaceSchemaLocation="settings.xsd">
	<user max-logins="99" name="tpepdc">
		<erase-settings>
			<date>
				<from>2001-01-01</from>
				<to>2001-01-01</to>
			</date>
			<sender>sender</sender>
			<header-pattern>header-pattern</header-pattern>
			<content-type>content-type</content-type>
			<size-bytes>
				<from>0</from>
				<to>0</to>
			</size-bytes>
			<structure>structure</structure>
		</erase-settings>
		<transform-settings leet="true" />
		<schedule>
			<from>0</from>
			<to>1400</to>
		</schedule>
		<server>server</server>
	</user>
	<blacklist>
		<ip>255.255.255.2</ip>
	</blacklist>
</XMLProxySettings>
